{
  "$schema": "https://json-schema.org/draft/2020-12/schema",
  "$id": "https://github.com/choulinc/SlurmBar/protocol/schema/snapshot.schema.json",
  "title": "SlurmBar snapshot",
  "description": "Normalized response of `slurmbar-agent snapshot --json`. All timestamps are UTC ISO 8601 with a trailing Z. All durations are integer seconds. All byte values are integers. All percentages are numbers in [0, 100]. Unavailable values are null and are never invented.",
  "type": "object",
  "required": [
    "schema_version",
    "generated_at",
    "cluster",
    "summary",
    "jobs",
    "warnings"
  ],
  "additionalProperties": false,
  "properties": {
    "schema_version": {
      "const": 1
    },
    "generated_at": {
      "$ref": "#/$defs/timestamp"
    },
    "agent_version": {
      "type": [
        "string",
        "null"
      ]
    },
    "cluster": {
      "type": "object",
      "required": [
        "name",
        "hostname",
        "slurm_version"
      ],
      "additionalProperties": false,
      "properties": {
        "name": {
          "type": [
            "string",
            "null"
          ],
          "description": "Cluster name reported by Slurm, or null."
        },
        "hostname": {
          "type": [
            "string",
            "null"
          ],
          "description": "Hostname of the login node the agent ran on."
        },
        "slurm_version": {
          "type": [
            "string",
            "null"
          ]
        }
      }
    },
    "summary": {
      "type": "object",
      "required": [
        "running",
        "pending",
        "completing",
        "failed_recently",
        "cancelled_recently",
        "completed_recently"
      ],
      "additionalProperties": false,
      "properties": {
        "running": {
          "type": "integer",
          "minimum": 0
        },
        "pending": {
          "type": "integer",
          "minimum": 0
        },
        "completing": {
          "type": "integer",
          "minimum": 0
        },
        "failed_recently": {
          "type": "integer",
          "minimum": 0
        },
        "cancelled_recently": {
          "type": "integer",
          "minimum": 0
        },
        "completed_recently": {
          "type": "integer",
          "minimum": 0
        }
      }
    },
    "jobs": {
      "type": "array",
      "items": {
        "$ref": "#/$defs/job"
      }
    },
    "warnings": {
      "type": "array",
      "items": {
        "$ref": "#/$defs/warning"
      }
    }
  },
  "$defs": {
    "timestamp": {
      "type": [
        "string",
        "null"
      ],
      "pattern": "^\\d{4}-\\d{2}-\\d{2}T\\d{2}:\\d{2}:\\d{2}Z$"
    },
    "state": {
      "type": "string",
      "description": "Normalized job state. Consumers MUST treat unrecognized values as UNKNOWN rather than failing.",
      "enum": [
        "PENDING",
        "RUNNING",
        "SUSPENDED",
        "COMPLETING",
        "COMPLETED",
        "FAILED",
        "CANCELLED",
        "TIMEOUT",
        "OUT_OF_MEMORY",
        "NODE_FAIL",
        "PREEMPTED",
        "BOOT_FAIL",
        "DEADLINE",
        "REQUEUED",
        "UNKNOWN"
      ]
    },
    "memory_semantics": {
      "type": "string",
      "description": "What a memory number actually means. Never claim a value is live total job memory when it is not.",
      "enum": [
        "peak_rss",
        "peak_rss_per_step",
        "current_rss",
        "requested_total",
        "requested_per_node",
        "requested_per_cpu",
        "unavailable"
      ]
    },
    "job": {
      "type": "object",
      "required": [
        "job_id",
        "name",
        "user",
        "state",
        "state_raw",
        "resources",
        "progress"
      ],
      "additionalProperties": false,
      "properties": {
        "job_id": {
          "type": "string",
          "description": "Slurm job id as a string. Array tasks use the `<job>_<task>` form."
        },
        "slurm_job_id": {
          "type": [
            "string",
            "null"
          ],
          "description": "The id Slurm uses internally. For an array task this differs from job_id (job_id '123_4' may have slurm_job_id '127') and is what sstat answers with. null when the source could not supply it."
        },
        "array_job_id": {
          "type": [
            "string",
            "null"
          ]
        },
        "array_task_id": {
          "type": [
            "string",
            "null"
          ]
        },
        "name": {
          "type": "string"
        },
        "user": {
          "type": [
            "string",
            "null"
          ]
        },
        "account": {
          "type": [
            "string",
            "null"
          ]
        },
        "partition": {
          "type": [
            "string",
            "null"
          ]
        },
        "qos": {
          "type": [
            "string",
            "null"
          ]
        },
        "state": {
          "$ref": "#/$defs/state"
        },
        "state_raw": {
          "type": [
            "string",
            "null"
          ],
          "description": "Unmodified Slurm state string."
        },
        "reason": {
          "type": [
            "string",
            "null"
          ],
          "description": "Pending reason, or null when not pending / not reported."
        },
        "submit_time": {
          "$ref": "#/$defs/timestamp"
        },
        "start_time": {
          "$ref": "#/$defs/timestamp"
        },
        "end_time": {
          "$ref": "#/$defs/timestamp"
        },
        "elapsed_seconds": {
          "type": [
            "integer",
            "null"
          ],
          "minimum": 0
        },
        "time_limit_seconds": {
          "type": [
            "integer",
            "null"
          ],
          "minimum": 0,
          "description": "null when unlimited or unknown."
        },
        "nodes": {
          "type": "array",
          "items": {
            "type": "string"
          }
        },
        "node_count": {
          "type": [
            "integer",
            "null"
          ],
          "minimum": 0
        },
        "cpus": {
          "type": [
            "integer",
            "null"
          ],
          "minimum": 0
        },
        "gpus": {
          "type": [
            "integer",
            "null"
          ],
          "minimum": 0
        },
        "work_dir": {
          "type": [
            "string",
            "null"
          ]
        },
        "stdout_path": {
          "type": [
            "string",
            "null"
          ]
        },
        "stderr_path": {
          "type": [
            "string",
            "null"
          ]
        },
        "exit_code": {
          "type": [
            "integer",
            "null"
          ]
        },
        "signal": {
          "type": [
            "integer",
            "null"
          ]
        },
        "source": {
          "type": "string",
          "description": "Which Slurm subsystem the record came from.",
          "enum": [
            "squeue",
            "sacct"
          ]
        },
        "resources": {
          "$ref": "#/$defs/resources"
        },
        "progress": {
          "oneOf": [
            {
              "$ref": "#/$defs/progress"
            },
            {
              "type": "null"
            }
          ]
        }
      }
    },
    "resources": {
      "type": "object",
      "required": [
        "memory_used_bytes",
        "memory_limit_bytes",
        "memory_semantics"
      ],
      "additionalProperties": false,
      "properties": {
        "memory_used_bytes": {
          "type": [
            "integer",
            "null"
          ],
          "minimum": 0
        },
        "memory_limit_bytes": {
          "type": [
            "integer",
            "null"
          ],
          "minimum": 0
        },
        "memory_semantics": {
          "$ref": "#/$defs/memory_semantics"
        },
        "memory_limit_semantics": {
          "$ref": "#/$defs/memory_semantics"
        },
        "gpu_memory_used_bytes": {
          "type": [
            "integer",
            "null"
          ],
          "minimum": 0
        },
        "gpu_memory_limit_bytes": {
          "type": [
            "integer",
            "null"
          ],
          "minimum": 0
        },
        "gpu_utilization_percent": {
          "type": [
            "number",
            "null"
          ],
          "minimum": 0,
          "maximum": 100
        },
        "cpu_utilization_percent": {
          "type": [
            "number",
            "null"
          ],
          "minimum": 0,
          "maximum": 100
        }
      }
    },
    "progress": {
      "type": "object",
      "required": [
        "source",
        "current",
        "total",
        "unit",
        "percent",
        "updated_at",
        "stale"
      ],
      "additionalProperties": false,
      "properties": {
        "source": {
          "type": "string",
          "description": "structured_file is authoritative. log_parser is a best-effort guess and must be labelled as such in any UI.",
          "enum": [
            "structured_file",
            "log_parser"
          ]
        },
        "confidence": {
          "type": [
            "string",
            "null"
          ],
          "enum": [
            "high",
            "medium",
            "low",
            null
          ],
          "description": "Always high for structured_file. medium/low for log_parser."
        },
        "kind": {
          "type": [
            "string",
            "null"
          ],
          "description": "Workload kind, e.g. training, preprocessing, simulation."
        },
        "phase": {
          "type": [
            "string",
            "null"
          ]
        },
        "current": {
          "type": [
            "number",
            "null"
          ],
          "minimum": 0
        },
        "total": {
          "type": [
            "number",
            "null"
          ],
          "minimum": 0,
          "description": "null when the total is genuinely unknown."
        },
        "unit": {
          "type": [
            "string",
            "null"
          ],
          "description": "e.g. epoch, step, item, timestep."
        },
        "percent": {
          "type": [
            "number",
            "null"
          ],
          "minimum": 0,
          "maximum": 100
        },
        "message": {
          "type": [
            "string",
            "null"
          ]
        },
        "updated_at": {
          "$ref": "#/$defs/timestamp"
        },
        "started_at": {
          "$ref": "#/$defs/timestamp"
        },
        "stale": {
          "type": "boolean"
        },
        "eta_seconds": {
          "type": [
            "integer",
            "null"
          ],
          "minimum": 0
        },
        "completion": {
          "type": [
            "string",
            "null"
          ],
          "enum": [
            "running",
            "completed",
            "failed",
            null
          ]
        },
        "error": {
          "type": [
            "string",
            "null"
          ]
        },
        "metrics": {
          "type": "object",
          "description": "Free-form scalar metrics. Values are numbers, strings, booleans or null.",
          "additionalProperties": {
            "type": [
              "number",
              "string",
              "boolean",
              "null"
            ]
          }
        }
      }
    },
    "warning": {
      "type": "object",
      "required": [
        "code",
        "message",
        "severity"
      ],
      "additionalProperties": false,
      "properties": {
        "code": {
          "type": "string",
          "description": "Stable machine-readable warning code. Consumers must tolerate unknown codes.",
          "enum": [
            "SLURM_MISSING",
            "SQUEUE_FAILED",
            "SQUEUE_JSON_UNSUPPORTED",
            "SQUEUE_TEXT_UNPARSABLE",
            "SACCT_UNAVAILABLE",
            "SACCT_FAILED",
            "ACCOUNTING_DISABLED",
            "SSTAT_UNAVAILABLE",
            "SSTAT_FAILED",
            "MEMORY_UNAVAILABLE",
            "GPU_METRICS_UNAVAILABLE",
            "PROGRESS_DIR_MISSING",
            "PROGRESS_FILE_INVALID",
            "PROGRESS_SCHEMA_UNSUPPORTED",
            "PROGRESS_STALE",
            "LOG_PATH_UNKNOWN",
            "LOG_UNREADABLE",
            "LOG_PROGRESS_BUDGET_EXCEEDED",
            "COMMAND_TIMEOUT",
            "COMMAND_FAILED",
            "PARTIAL_DATA"
          ]
        },
        "message": {
          "type": "string"
        },
        "severity": {
          "type": "string",
          "enum": [
            "info",
            "warning",
            "error"
          ]
        },
        "detail": {
          "type": [
            "string",
            "null"
          ]
        },
        "job_id": {
          "type": [
            "string",
            "null"
          ]
        }
      }
    }
  }
}
